{
  "blockers": [
    "BOARD_SPACE_KEY_CENTER_VALIDATION_MISSING",
    "BOARD_TO_ROBOT_TRANSFORM_UNVERIFIED",
    "PHYSICAL_CLEARANCE_UNVERIFIED"
  ],
  "board_space_motion_targets_emitted": false,
  "board_to_robot_transform_verified": false,
  "contact_authorized": false,
  "image_space_key_center_candidates_ready": true,
  "independent_key_center_observations_present": true,
  "individual_key_localization_ready": false,
  "key_center_candidate_count": 46,
  "key_center_candidates": [
    {
      "candidate_repeatability_passed": true,
      "key_id": "1",
      "reference_center_xy_mm": [
        21.0,
        105.5
      ],
      "reference_edge_span_xy_mm": [
        18.667,
        19.0
      ],
      "reference_minimum_edge_peak_ratio": 1.69,
      "repeat_center_xy_mm": [
        21.0,
        106.333
      ],
      "repeat_edge_span_xy_mm": [
        18.667,
        17.333
      ],
      "repeat_minimum_edge_peak_ratio": 1.459,
      "span_plausibility_passed": true,
      "temporal_center_delta_mm": 0.833
    },
    {
      "candidate_repeatability_passed": true,
      "key_id": "2",
      "reference_center_xy_mm": [
        39.5,
        106.333
      ],
      "reference_edge_span_xy_mm": [
        18.333,
        18.667
      ],
      "reference_minimum_edge_peak_ratio": 1.396,
      "repeat_center_xy_mm": [
        39.333,
        106.833
      ],
      "repeat_edge_span_xy_mm": [
        18.0,
        17.667
      ],
      "repeat_minimum_edge_peak_ratio": 1.556,
      "span_plausibility_passed": true,
      "temporal_center_delta_mm": 0.527
    },
    {
      "candidate_repeatability_passed": true,
      "key_id": "3",
      "reference_center_xy_mm": [
        58.833,
        105.833
      ],
      "reference_edge_span_xy_mm": [
        20.333,
        20.333
      ],
      "reference_minimum_edge_peak_ratio": 1.745,
      "repeat_center_xy_mm": [
        58.667,
        106.667
      ],
      "repeat_edge_span_xy_mm": [
        20.667,
        18.667
      ],
      "repeat_minimum_edge_peak_ratio": 1.67,
      "span_plausibility_passed": true,
      "temporal_center_delta_mm": 0.85
    },
    {
      "candidate_repeatability_passed": true,
      "key_id": "4",
      "reference_center_xy_mm": [
        76.667,
        106.667
      ],
      "reference_edge_span_xy_mm": [
        18.667,
        19.333
      ],
      "reference_minimum_edge_peak_ratio": 1.427,
      "repeat_center_xy_mm": [
        76.667,
        106.667
      ],
      "repeat_edge_span_xy_mm": [
        18.667,
        18.667
      ],
      "repeat_minimum_edge_peak_ratio": 1.82,
      "span_plausibility_passed": true,
      "temporal_center_delta_mm": 0.0
    },
    {
      "candidate_repeatability_passed": true,
      "key_id": "5",
      "reference_center_xy_mm": [
        95.167,
        107.0
      ],
      "reference_edge_span_xy_mm": [
        18.333,
        18.667
      ],
      "reference_minimum_edge_peak_ratio": 1.564,
      "repeat_center_xy_mm": [
        95.167,
        106.333
      ],
      "repeat_edge_span_xy_mm": [
        18.333,
        20.0
      ],
      "repeat_minimum_edge_peak_ratio": 1.888,
      "span_plausibility_passed": true,
      "temporal_center_delta_mm": 0.667
    },
    {
      "candidate_repeatability_passed": true,
      "key_id": "6",
      "reference_center_xy_mm": [
        113.667,
        106.333
      ],
      "reference_edge_span_xy_mm": [
        18.667,
        20.0
      ],
      "reference_minimum_edge_peak_ratio": 1.95,
      "repeat_center_xy_mm": [
        114.0,
        106.5
      ],
      "repeat_edge_span_xy_mm": [
        19.333,
        20.333
      ],
      "repeat_minimum_edge_peak_ratio": 1.676,
      "span_plausibility_passed": true,
      "temporal_center_delta_mm": 0.373
    },
    {
      "candidate_repeatability_passed": true,
      "key_id": "7",
      "reference_center_xy_mm": [
        132.833,
        107.5
      ],
      "reference_edge_span_xy_mm": [
        19.667,
        19.0
      ],
      "reference_minimum_edge_peak_ratio": 1.355,
      "repeat_center_xy_mm": [
        133.167,
        107.5
      ],
      "repeat_edge_span_xy_mm": [
        19.0,
        18.333
      ],
      "repeat_minimum_edge_peak_ratio": 1.302,
      "span_plausibility_passed": true,
      "temporal_center_delta_mm": 0.334
    },
    {
      "candidate_repeatability_passed": true,
      "key_id": "8",
      "reference_center_xy_mm": [
        152.667,
        105.667
      ],
      "reference_edge_span_xy_mm": [
        20.0,
        18.667
      ],
      "reference_minimum_edge_peak_ratio": 1.319,
      "repeat_center_xy_mm": [
        152.667,
        107.833
      ],
      "repeat_edge_span_xy_mm": [
        20.0,
        19.0
      ],
      "repeat_minimum_edge_peak_ratio": 1.318,
      "span_plausibility_passed": true,
      "temporal_center_delta_mm": 2.166
    },
    {
      "candidate_repeatability_passed": true,
      "key_id": "9",
      "reference_center_xy_mm": [
        172.167,
        106.333
      ],
      "reference_edge_span_xy_mm": [
        19.0,
        20.0
      ],
      "reference_minimum_edge_peak_ratio": 1.235,
      "repeat_center_xy_mm": [
        172.333,
        106.5
      ],
      "repeat_edge_span_xy_mm": [
        19.333,
        21.667
      ],
      "repeat_minimum_edge_peak_ratio": 1.185,
      "span_plausibility_passed": true,
      "temporal_center_delta_mm": 0.235
    },
    {
      "candidate_repeatability_passed": true,
      "key_id": "0",
      "reference_center_xy_mm": [
        191.333,
        106.5
      ],
      "reference_edge_span_xy_mm": [
        19.333,
        20.333
      ],
      "reference_minimum_edge_peak_ratio": 1.776,
      "repeat_center_xy_mm": [
        190.833,
        106.333
      ],
      "repeat_edge_span_xy_mm": [
        17.667,
        20.0
      ],
      "repeat_minimum_edge_peak_ratio": 1.345,
      "span_plausibility_passed": true,
      "temporal_center_delta_mm": 0.527
    },
    {
      "candidate_repeatability_passed": true,
      "key_id": "MINUS",
      "reference_center_xy_mm": [
        209.833,
        107.0
      ],
      "reference_edge_span_xy_mm": [
        17.667,
        19.333
      ],
      "reference_minimum_edge_peak_ratio": 1.14,
      "repeat_center_xy_mm": [
        209.333,
        105.5
      ],
      "repeat_edge_span_xy_mm": [
        19.333,
        21.0
      ],
      "repeat_minimum_edge_peak_ratio": 1.62,
      "span_plausibility_passed": true,
      "temporal_center_delta_mm": 1.581
    },
    {
      "candidate_repeatability_passed": true,
      "key_id": "EQUAL",
      "reference_center_xy_mm": [
        228.667,
        107.167
      ],
      "reference_edge_span_xy_mm": [
        21.333,
        19.0
      ],
      "reference_minimum_edge_peak_ratio": 1.243,
      "repeat_center_xy_mm": [
        229.167,
        107.333
      ],
      "repeat_edge_span_xy_mm": [
        20.333,
        18.0
      ],
      "repeat_minimum_edge_peak_ratio": 1.867,
      "span_plausibility_passed": true,
      "temporal_center_delta_mm": 0.527
    },
    {
      "candidate_repeatability_passed": true,
      "key_id": "Q",
      "reference_center_xy_mm": [
        32.5,
        84.5
      ],
      "reference_edge_span_xy_mm": [
        18.333,
        19.667
      ],
      "reference_minimum_edge_peak_ratio": 1.388,
      "repeat_center_xy_mm": [
        32.333,
        84.5
      ],
      "repeat_edge_span_xy_mm": [
        19.333,
        20.333
      ],
      "repeat_minimum_edge_peak_ratio": 1.306,
      "span_plausibility_passed": true,
      "temporal_center_delta_mm": 0.167
    },
    {
      "candidate_repeatability_passed": true,
      "key_id": "W",
      "reference_center_xy_mm": [
        50.833,
        84.667
      ],
      "reference_edge_span_xy_mm": [
        18.333,
        19.333
      ],
      "reference_minimum_edge_peak_ratio": 1.325,
      "repeat_center_xy_mm": [
        51.0,
        84.5
      ],
      "repeat_edge_span_xy_mm": [
        18.0,
        20.333
      ],
      "repeat_minimum_edge_peak_ratio": 1.25,
      "span_plausibility_passed": true,
      "temporal_center_delta_mm": 0.236
    },
    {
      "candidate_repeatability_passed": true,
      "key_id": "E",
      "reference_center_xy_mm": [
        69.667,
        86.0
      ],
      "reference_edge_span_xy_mm": [
        19.333,
        22.0
      ],
      "reference_minimum_edge_peak_ratio": 1.427,
      "repeat_center_xy_mm": [
        69.5,
        84.5
      ],
      "repeat_edge_span_xy_mm": [
        19.0,
        20.333
      ],
      "repeat_minimum_edge_peak_ratio": 1.574,
      "span_plausibility_passed": true,
      "temporal_center_delta_mm": 1.509
    },
    {
      "candidate_repeatability_passed": true,
      "key_id": "R",
      "reference_center_xy_mm": [
        88.667,
        84.667
      ],
      "reference_edge_span_xy_mm": [
        18.667,
        19.333
      ],
      "reference_minimum_edge_peak_ratio": 1.374,
      "repeat_center_xy_mm": [
        87.667,
        85.0
      ],
      "repeat_edge_span_xy_mm": [
        17.333,
        19.333
      ],
      "repeat_minimum_edge_peak_ratio": 1.74,
      "span_plausibility_passed": true,
      "temporal_center_delta_mm": 1.054
    },
    {
      "candidate_repeatability_passed": true,
      "key_id": "T",
      "reference_center_xy_mm": [
        106.667,
        85.667
      ],
      "reference_edge_span_xy_mm": [
        17.333,
        21.333
      ],
      "reference_minimum_edge_peak_ratio": 1.418,
      "repeat_center_xy_mm": [
        105.833,
        85.833
      ],
      "repeat_edge_span_xy_mm": [
        19.0,
        21.0
      ],
      "repeat_minimum_edge_peak_ratio": 1.262,
      "span_plausibility_passed": true,
      "temporal_center_delta_mm": 0.85
    },
    {
      "candidate_repeatability_passed": true,
      "key_id": "Y",
      "reference_center_xy_mm": [
        125.167,
        84.833
      ],